examples/code/gemm_config.in
batch_size, seq_len, head_num, size_per_head dataType ### batchCount, n, m, k, algoId, customOption, tile, numSplitsK, swizzle, reductionScheme, workspaceSize, stages, exec_time
3 2048 16 128 1 ### 1 6144 6144 2048 100 -1 -1 -1 -1 -1 -1 -1 2.486810
3 2048 16 128 1 ### 48 2048 2048 128 113 -1 -1 -1 -1 -1 -1 -1 1.709660
3 2048 16 128 1 ### 48 128 2048 2048 110 -1 -1 -1 -1 -1 -1 -1 0.954120
3 2048 16 128 1 ### 1 2048 6144 2048 103 -1 -1 -1 -1 -1 -1 -1 0.888710
3 2048 16 128 1 ### 1 8192 6144 2048 100 -1 -1 -1 -1 -1 -1 -1 3.416890
3 2048 16 128 1 ### 1 2048 6144 8192 107 -1 -1 -1 -1 -1 -1 -1 3.474500
3 1 16 128 1 ### 1 6144 3 2048 21 0 15 1 0 0 0 0 0.049500
3 1 16 128 1 ### 1 2048 3 2048 21 0 5 1 0 0 0 20 0.019036
3 1 16 128 1 ### 1 8192 3 2048 21 0 15 1 0 0 0 0 0.062709
3 1 16 128 1 ### 1 2048 3 8192 21 0 5 1 0 0 0 20 0.063364
3 1 16 128 1 ### 1 50048 3 2048 112 -1 -1 -1 -1 -1 -1 -1 0.392450
